timestamp	trial	status	old_score	new_score	proposal	description
2026-03-11T11:05:17.887045+00:00	1	reverted	0.2000	0.2000	bad_patch.py	applied bad proposal
2026-03-11T11:05:17.920737+00:00	2	kept	0.2000	1.0000	fix_patch.py	applied good proposal
2026-03-11T11:05:40.063680+00:00	1	reverted	0.2000	0.2000	bad_patch.py	applied bad proposal
2026-03-11T11:05:40.097842+00:00	2	kept	0.2000	1.0000	fix_patch.py	applied good proposal
